<?xml version="1.0" encoding="UTF-8"?>
<xs:schema xmlns:xs="http://www.w3.org/2001/XMLSchema"
    xmlns:vc="http://www.w3.org/2007/XMLSchema-versioning" elementFormDefault="qualified"
    vc:minVersion="1.1">

    <xs:element name="arquivo_biografias">
        <xs:complexType>
            <xs:sequence maxOccurs="unbounded" minOccurs="0">
                <xs:element ref="biografia"/>
            </xs:sequence>
        </xs:complexType>
    </xs:element>
    <xs:element name="biografia">
        <xs:complexType>
            <xs:sequence>
                <xs:element name="data" type="xs:date"/>
                <xs:element name="sujeito" type="xs:string"/>
                <xs:element name="local" type="xs:string"/>
                <xs:element minOccurs="0" name="evento" type="xs:string"/>
            </xs:sequence>
        </xs:complexType>
    </xs:element>
</xs:schema>
